{
 "format": "sajja-data-v1",
 "exportedAt": "2026-10-11T09:50:15.613Z",
 "appVersion": "1.0.0",
 "data": {
  "members": [
   {
    "id": "S001",
    "code": "001",
    "type": "members",
    "name": "สมจิตร ใจดี",
    "nick": "จิตร",
    "phone": "0811111111",
    "monthly": 50,
    "joined": "2025-09-05",
    "status": "active",
    "updatedAt": "2026-10-11T09:50:15.613Z"
   },
   {
    "id": "S002",
    "code": "002",
    "type": "members",
    "name": "ประเสริฐ ช่วยเรือง",
    "nick": "เสริฐ",
    "phone": "0822222222",
    "monthly": 50,
    "joined": "2025-09-05",
    "status": "active",
    "updatedAt": "2026-10-11T09:50:15.613Z"
   },
   {
    "id": "S003",
    "code": "003",
    "type": "members",
    "name": "วิไล พงษ์สุข",
    "nick": "วิ",
    "phone": "0833333333",
    "monthly": 100,
    "joined": "2026-01-05",
    "status": "active",
    "updatedAt": "2026-10-11T09:50:15.613Z"
   },
   {
    "id": "S004",
    "code": "004",
    "type": "members",
    "name": "ดำรงค์ ศรีบุญ",
    "nick": "ดำ",
    "phone": "0844444444",
    "monthly": 30,
    "joined": "2026-03-05",
    "status": "active",
    "updatedAt": "2026-10-11T09:50:15.613Z"
   },
   {
    "id": "S005",
    "code": "005",
    "type": "members",
    "name": "บุญมา แก้วกล้า",
    "nick": "มา",
    "phone": "0855555555",
    "monthly": 50,
    "joined": "2026-05-05",
    "status": "active",
    "updatedAt": "2026-10-11T09:50:15.613Z"
   }
  ],
  "txs": [
   {
    "id": "tx0001",
    "type": "txs",
    "note": "",
    "updatedAt": "2026-10-11T09:50:15.613Z",
    "kind": "saja",
    "member": "S001",
    "ym": "2025-09",
    "amount": 50,
    "at": "2025-09-10"
   },
   {
    "id": "tx0002",
    "type": "txs",
    "note": "",
    "updatedAt": "2026-10-11T09:50:15.614Z",
    "kind": "saja",
    "member": "S001",
    "ym": "2025-10",
    "amount": 50,
    "at": "2025-10-10"
   },
   {
    "id": "tx0003",
    "type": "txs",
    "note": "",
    "updatedAt": "2026-10-11T09:50:15.614Z",
    "kind": "saja",
    "member": "S001",
    "ym": "2025-11",
    "amount": 50,
    "at": "2025-11-10"
   },
   {
    "id": "tx0004",
    "type": "txs",
    "note": "",
    "updatedAt": "2026-10-11T09:50:15.614Z",
    "kind": "saja",
    "member": "S001",
    "ym": "2025-12",
    "amount": 50,
    "at": "2025-12-10"
   },
   {
    "id": "tx0005",
    "type": "txs",
    "note": "",
    "updatedAt": "2026-10-11T09:50:15.614Z",
    "kind": "saja",
    "member": "S001",
    "ym": "2026-01",
    "amount": 50,
    "at": "2026-01-10"
   },
   {
    "id": "tx0006",
    "type": "txs",
    "note": "",
    "updatedAt": "2026-10-11T09:50:15.614Z",
    "kind": "saja",
    "member": "S001",
    "ym": "2026-02",
    "amount": 50,
    "at": "2026-02-10"
   },
   {
    "id": "tx0007",
    "type": "txs",
    "note": "",
    "updatedAt": "2026-10-11T09:50:15.614Z",
    "kind": "saja",
    "member": "S001",
    "ym": "2026-03",
    "amount": 50,
    "at": "2026-03-10"
   },
   {
    "id": "tx0008",
    "type": "txs",
    "note": "",
    "updatedAt": "2026-10-11T09:50:15.614Z",
    "kind": "saja",
    "member": "S001",
    "ym": "2026-04",
    "amount": 50,
    "at": "2026-04-10"
   },
   {
    "id": "tx0009",
    "type": "txs",
    "note": "",
    "updatedAt": "2026-10-11T09:50:15.614Z",
    "kind": "saja",
    "member": "S001",
    "ym": "2026-05",
    "amount": 50,
    "at": "2026-05-10"
   },
   {
    "id": "tx0010",
    "type": "txs",
    "note": "",
    "updatedAt": "2026-10-11T09:50:15.614Z",
    "kind": "saja",
    "member": "S001",
    "ym": "2026-06",
    "amount": 50,
    "at": "2026-06-10"
   },
   {
    "id": "tx0011",
    "type": "txs",
    "note": "",
    "updatedAt": "2026-10-11T09:50:15.614Z",
    "kind": "saja",
    "member": "S001",
    "ym": "2026-07",
    "amount": 50,
    "at": "2026-07-10"
   },
   {
    "id": "tx0012",
    "type": "txs",
    "note": "",
    "updatedAt": "2026-10-11T09:50:15.614Z",
    "kind": "saja",
    "member": "S001",
    "ym": "2026-08",
    "amount": 50,
    "at": "2026-08-10"
   },
   {
    "id": "tx0013",
    "type": "txs",
    "note": "",
    "updatedAt": "2026-10-11T09:50:15.614Z",
    "kind": "saja",
    "member": "S001",
    "ym": "2026-09",
    "amount": 50,
    "at": "2026-09-10"
   },
   {
    "id": "tx0014",
    "type": "txs",
    "note": "",
    "updatedAt": "2026-10-11T09:50:15.614Z",
    "kind": "saja",
    "member": "S001",
    "ym": "2026-10",
    "amount": 50,
    "at": "2026-10-10"
   },
   {
    "id": "tx0015",
    "type": "txs",
    "note": "",
    "updatedAt": "2026-10-11T09:50:15.614Z",
    "kind": "saja",
    "member": "S002",
    "ym": "2025-09",
    "amount": 50,
    "at": "2025-09-10"
   },
   {
    "id": "tx0016",
    "type": "txs",
    "note": "",
    "updatedAt": "2026-10-11T09:50:15.614Z",
    "kind": "saja",
    "member": "S002",
    "ym": "2025-10",
    "amount": 50,
    "at": "2025-10-10"
   },
   {
    "id": "tx0017",
    "type": "txs",
    "note": "",
    "updatedAt": "2026-10-11T09:50:15.614Z",
    "kind": "saja",
    "member": "S002",
    "ym": "2025-11",
    "amount": 50,
    "at": "2025-11-10"
   },
   {
    "id": "tx0018",
    "type": "txs",
    "note": "",
    "updatedAt": "2026-10-11T09:50:15.614Z",
    "kind": "saja",
    "member": "S002",
    "ym": "2025-12",
    "amount": 50,
    "at": "2025-12-10"
   },
   {
    "id": "tx0019",
    "type": "txs",
    "note": "",
    "updatedAt": "2026-10-11T09:50:15.614Z",
    "kind": "saja",
    "member": "S002",
    "ym": "2026-01",
    "amount": 50,
    "at": "2026-01-10"
   },
   {
    "id": "tx0020",
    "type": "txs",
    "note": "",
    "updatedAt": "2026-10-11T09:50:15.614Z",
    "kind": "saja",
    "member": "S002",
    "ym": "2026-02",
    "amount": 50,
    "at": "2026-02-10"
   },
   {
    "id": "tx0021",
    "type": "txs",
    "note": "",
    "updatedAt": "2026-10-11T09:50:15.614Z",
    "kind": "saja",
    "member": "S002",
    "ym": "2026-03",
    "amount": 50,
    "at": "2026-03-10"
   },
   {
    "id": "tx0022",
    "type": "txs",
    "note": "",
    "updatedAt": "2026-10-11T09:50:15.614Z",
    "kind": "saja",
    "member": "S002",
    "ym": "2026-04",
    "amount": 50,
    "at": "2026-04-10"
   },
   {
    "id": "tx0023",
    "type": "txs",
    "note": "",
    "updatedAt": "2026-10-11T09:50:15.614Z",
    "kind": "saja",
    "member": "S002",
    "ym": "2026-05",
    "amount": 50,
    "at": "2026-05-10"
   },
   {
    "id": "tx0024",
    "type": "txs",
    "note": "",
    "updatedAt": "2026-10-11T09:50:15.614Z",
    "kind": "saja",
    "member": "S002",
    "ym": "2026-07",
    "amount": 50,
    "at": "2026-07-10"
   },
   {
    "id": "tx0025",
    "type": "txs",
    "note": "",
    "updatedAt": "2026-10-11T09:50:15.614Z",
    "kind": "saja",
    "member": "S002",
    "ym": "2026-08",
    "amount": 50,
    "at": "2026-08-10"
   },
   {
    "id": "tx0026",
    "type": "txs",
    "note": "",
    "updatedAt": "2026-10-11T09:50:15.614Z",
    "kind": "saja",
    "member": "S002",
    "ym": "2026-09",
    "amount": 50,
    "at": "2026-09-10"
   },
   {
    "id": "tx0027",
    "type": "txs",
    "note": "",
    "updatedAt": "2026-10-11T09:50:15.614Z",
    "kind": "saja",
    "member": "S002",
    "ym": "2026-10",
    "amount": 50,
    "at": "2026-10-10"
   },
   {
    "id": "tx0028",
    "type": "txs",
    "note": "",
    "updatedAt": "2026-10-11T09:50:15.614Z",
    "kind": "saja",
    "member": "S003",
    "ym": "2026-01",
    "amount": 100,
    "at": "2026-01-10"
   },
   {
    "id": "tx0029",
    "type": "txs",
    "note": "",
    "updatedAt": "2026-10-11T09:50:15.614Z",
    "kind": "saja",
    "member": "S003",
    "ym": "2026-02",
    "amount": 100,
    "at": "2026-02-10"
   },
   {
    "id": "tx0030",
    "type": "txs",
    "note": "",
    "updatedAt": "2026-10-11T09:50:15.614Z",
    "kind": "saja",
    "member": "S003",
    "ym": "2026-03",
    "amount": 100,
    "at": "2026-03-10"
   },
   {
    "id": "tx0031",
    "type": "txs",
    "note": "",
    "updatedAt": "2026-10-11T09:50:15.614Z",
    "kind": "saja",
    "member": "S003",
    "ym": "2026-04",
    "amount": 100,
    "at": "2026-04-10"
   },
   {
    "id": "tx0032",
    "type": "txs",
    "note": "",
    "updatedAt": "2026-10-11T09:50:15.614Z",
    "kind": "saja",
    "member": "S003",
    "ym": "2026-05",
    "amount": 100,
    "at": "2026-05-10"
   },
   {
    "id": "tx0033",
    "type": "txs",
    "note": "",
    "updatedAt": "2026-10-11T09:50:15.614Z",
    "kind": "saja",
    "member": "S003",
    "ym": "2026-06",
    "amount": 100,
    "at": "2026-06-10"
   },
   {
    "id": "tx0034",
    "type": "txs",
    "note": "",
    "updatedAt": "2026-10-11T09:50:15.614Z",
    "kind": "saja",
    "member": "S003",
    "ym": "2026-07",
    "amount": 100,
    "at": "2026-07-10"
   },
   {
    "id": "tx0035",
    "type": "txs",
    "note": "",
    "updatedAt": "2026-10-11T09:50:15.614Z",
    "kind": "saja",
    "member": "S003",
    "ym": "2026-09",
    "amount": 100,
    "at": "2026-09-10"
   },
   {
    "id": "tx0036",
    "type": "txs",
    "note": "",
    "updatedAt": "2026-10-11T09:50:15.614Z",
    "kind": "saja",
    "member": "S003",
    "ym": "2026-10",
    "amount": 100,
    "at": "2026-10-10"
   },
   {
    "id": "tx0037",
    "type": "txs",
    "note": "",
    "updatedAt": "2026-10-11T09:50:15.614Z",
    "kind": "saja",
    "member": "S004",
    "ym": "2026-03",
    "amount": 30,
    "at": "2026-03-10"
   },
   {
    "id": "tx0038",
    "type": "txs",
    "note": "",
    "updatedAt": "2026-10-11T09:50:15.614Z",
    "kind": "saja",
    "member": "S004",
    "ym": "2026-04",
    "amount": 30,
    "at": "2026-04-10"
   },
   {
    "id": "tx0039",
    "type": "txs",
    "note": "",
    "updatedAt": "2026-10-11T09:50:15.614Z",
    "kind": "saja",
    "member": "S004",
    "ym": "2026-05",
    "amount": 30,
    "at": "2026-05-10"
   },
   {
    "id": "tx0040",
    "type": "txs",
    "note": "",
    "updatedAt": "2026-10-11T09:50:15.614Z",
    "kind": "saja",
    "member": "S004",